{
  "schema_version": "1.0.0",
  "account_id": "40000000-0000-4000-8000-000000000001",
  "name": "daily cycle acceptance account",
  "strategy": {
    "name": "equal_weight",
    "version": "1.0.0",
    "git_commit": "unknown",
    "parameters": {"rebalance_frequency": "daily"}
  },
  "period": {"start_date": "2026-01-01", "end_date": "2026-12-31"},
  "universe": {
    "universe_id": "20000000-0000-4000-8000-000000000001",
    "version": "1.0.0",
    "security_ids": ["10000000-0000-4000-8000-000000000001"],
    "membership_fingerprint": "aaaaaaaaaaaaaaaaaaaaaaaaaaaaaaaaaaaaaaaaaaaaaaaaaaaaaaaaaaaaaaaa"
  },
  "security_metadata": [
    {
      "security_id": "10000000-0000-4000-8000-000000000001",
      "country": "US",
      "sector": "technology",
      "themes": ["ai"]
    }
  ],
  "inputs": [
    {
      "kind": "prices",
      "artifact_id": "30000000-0000-4000-8000-000000000001",
      "path": "inputs/prices.json",
      "sha256": "bbbbbbbbbbbbbbbbbbbbbbbbbbbbbbbbbbbbbbbbbbbbbbbbbbbbbbbbbbbbbbbb",
      "available_at": "2026-01-01T00:00:00Z",
      "fitness": "current_research_only"
    },
    {
      "kind": "calendar",
      "artifact_id": "30000000-0000-4000-8000-000000000002",
      "path": "inputs/calendar.json",
      "sha256": "bbbbbbbbbbbbbbbbbbbbbbbbbbbbbbbbbbbbbbbbbbbbbbbbbbbbbbbbbbbbbbbb",
      "available_at": "2026-01-01T00:00:00Z",
      "fitness": "current_research_only"
    },
    {
      "kind": "membership",
      "artifact_id": "30000000-0000-4000-8000-000000000003",
      "path": "inputs/membership.json",
      "sha256": "bbbbbbbbbbbbbbbbbbbbbbbbbbbbbbbbbbbbbbbbbbbbbbbbbbbbbbbbbbbbbbbb",
      "available_at": "2026-01-01T00:00:00Z",
      "fitness": "current_research_only"
    }
  ],
  "benchmark": {
    "security_id": "10000000-0000-4000-8000-000000000001",
    "currency": "USD"
  },
  "decision_policy": {
    "frequency": "daily",
    "decision_at": "close",
    "signal_delay_sessions": 1,
    "execution_price": "open",
    "stale_after_sessions": 10,
    "max_price_gap": "1"
  },
  "accounting_policy": {
    "base_currency": "USD",
    "initial_cash": "10000",
    "fractional_shares": true,
    "rebalance_frequency": "daily"
  },
  "cost_policy": {
    "version": "1.0.0",
    "commission_bps": "0",
    "fixed_fee": "0",
    "minimum_fee": "0",
    "spread_bps": "0",
    "slippage_bps": "0",
    "tax_bps": "0"
  },
  "risk_policy": {
    "version": "1.0.0",
    "max_gross_exposure": "1",
    "max_position_weight": "1",
    "max_sector_exposure": "1",
    "max_country_exposure": "1",
    "max_currency_exposure": "1",
    "max_theme_exposure": "1",
    "minimum_cash_reserve": "0",
    "max_turnover": "1",
    "max_daily_notional": "100000",
    "max_price_gap": "1",
    "max_stale_sessions": 10,
    "max_participation": "1",
    "max_drawdown": "1",
    "prohibited_security_ids": []
  },
  "approval_policy": {"mode": "auto"},
  "missing_data_policy": "halt_decision"
}
